{"schema_version":1,"decision":"READY","task_id":"task-fe-03b-answer-abstention","summary":"The gate is blocked by a locally repairable frontend dependency-installation defect, not an Angular/TypeScript source defect: the locked AJV 8.12.0 installation is incomplete because node_modules/ajv/dist/runtime/validation_error.js is missing. Current evidence does not justify editing application source or dependency manifests.","instructions":["Restore the existing lockfile-defined frontend dependency tree with a clean npm installation; do not change package.json, package-lock.json, Angular configuration, or application source for this failure.","Confirm that frontend/node_modules/ajv/dist/runtime/validation_error.js is restored by the installation.","Run the task’s exact gate. If it reveals a subsequent product-code failure, preserve that new evidence and plan only that evidenced failure; do not speculate from the present infrastructure failure."],"focus_paths":["frontend/package.json","frontend/package-lock.json","frontend/node_modules/ajv/"],"verification":["cd frontend && npm ci","test -f frontend/node_modules/ajv/dist/runtime/validation_error.js","git diff --check","./scripts/frontend-task-gate.sh task-fe-03b-answer-abstention"]}